{
  "profile_id": "omni_breakout|conservative_ramp|close_confirmation|no_pyramid|fixed_sl_trail|spread_gate|US100.cash",
  "engine": "omni_breakout",
  "instrument": "US100.cash",
  "version": "1.0.0",
  "dimensions": {
    "risk_model": "conservative_ramp",
    "entry_mode": "close_confirmation",
    "pyramid_model": "no_pyramid",
    "exit_model": "fixed_sl_trail",
    "filters": [
      "spread_gate"
    ]
  },
  "parameters": {
    "sl_pts": 35.0,
    "tp_pts": 50.0,
    "buffer_pts": 0.0,
    "trail_trigger_pts": 20.0,
    "trail_dist_pts": 15.0,
    "max_spread_pts": 3.0,
    "max_tranches": 1,
    "cooldown_seconds": 60.0,
    "base_lot_size": 4.5
  },
  "risk_bounds": {
    "max_risk_pct": 0.0075,
    "max_daily_loss_pct": 0.045,
    "account_floor": 90000.0,
    "max_lot_size": 12.0
  }
}
